{
  "manifestVersion": "1",
  "generatedAt": "2026-07-16T08:00:00Z",
  "implementation": {
    "name": "example-fixed-price-x402-seller",
    "version": "1.0.0",
    "repository": "https://example.invalid/dacs/x402-seller",
    "commit": "1111111111111111111111111111111111111111"
  },
  "profile": {
    "id": "DACS-v0.1",
    "repository": "https://github.com/DACS-Agent-commerce/DACS-Standard",
    "commit": "9a1ca624e8cc68361cff35c85a919cd72ba25199",
    "documents": {
      "CORE": "0.1",
      "DACS-1": "0.3",
      "DACS-2": "0.2",
      "DACS-3": "0.3",
      "DACS-4": "0.3",
      "DACS-5": "0.3"
    }
  },
  "roles": ["seller"],
  "conformanceSuite": {
    "repository": "https://github.com/DACS-Agent-commerce/DACS-Standard",
    "commit": "9a1ca624e8cc68361cff35c85a919cd72ba25199",
    "manifestPath": "conformance/MANIFEST.json",
    "manifestSha256": "d25d2af14adabc5ac7daa25a7c1424a5e8151d6fb08326d1f596d1204b05c30b"
  },
  "claims": [
    {
      "id": "claim-fixed-price",
      "level": "capability",
      "result": "implemented",
      "roles": ["seller"],
      "modules": ["DACS-3"],
      "capabilityRefs": ["fixed-price"],
      "ruleRefs": ["PS-3"],
      "evidenceRefs": ["fixed-price-vectors"]
    },
    {
      "id": "claim-pay-x402",
      "level": "capability",
      "result": "implemented",
      "roles": ["seller"],
      "modules": ["DACS-4"],
      "capabilityRefs": ["pay-x402"],
      "ruleRefs": ["DACS-4-9.5.7", "SB-1", "SB-2", "SB-3"],
      "evidenceRefs": ["x402-vectors"]
    },
    {
      "id": "claim-x402-default-rail",
      "level": "capability",
      "result": "implemented",
      "roles": ["seller"],
      "modules": ["DACS-4"],
      "capabilityRefs": ["x402-default-rail"],
      "ruleRefs": ["DACS-4-9.4.2"],
      "evidenceRefs": ["x402-vectors"]
    }
  ],
  "capabilities": [
    {
      "ref": "fixed-price",
      "kind": "negotiation-pattern",
      "id": "fixed-price",
      "modules": ["DACS-3"],
      "roles": ["seller"],
      "supportStatus": "implemented",
      "availability": "live",
      "testStatus": "partial",
      "evidenceRefs": ["fixed-price-vectors"]
    },
    {
      "ref": "pay-x402",
      "kind": "payment-phase",
      "id": "pay-x402",
      "modules": ["DACS-4"],
      "roles": ["seller"],
      "supportStatus": "implemented",
      "availability": "live",
      "testStatus": "partial",
      "evidenceRefs": ["x402-vectors"]
    },
    {
      "ref": "x402-default-rail",
      "kind": "payment-rail",
      "id": "x402:default",
      "modules": ["DACS-4"],
      "roles": ["seller"],
      "supportStatus": "implemented",
      "availability": "live",
      "testStatus": "partial",
      "evidenceRefs": ["x402-vectors"]
    }
  ],
  "testRuns": [
    {
      "id": "fixed-price-vectors",
      "result": "pass",
      "caseIds": ["neg-pattern-mismatch", "neg-ps3-fixed-over-negotiable", "neg-priceanchor-absent-ok"],
      "command": "example-agent conformance run --capability fixed-price"
    },
    {
      "id": "x402-vectors",
      "result": "pass",
      "caseIds": ["settlement-x402-pass"],
      "command": "example-agent conformance run --capability pay-x402"
    }
  ],
  "liveTests": [
    {
      "id": "base-sepolia-x402-live",
      "capabilityRefs": ["pay-x402"],
      "result": "pass",
      "executedAt": "2026-07-16T07:30:00Z",
      "evidence": "https://example.invalid/evidence/base-sepolia-x402-live"
    }
  ],
  "deviations": []
}
