{
  "manifestVersion": "1",
  "generatedAt": "2026-07-16T08:00:00Z",
  "implementation": {
    "name": "example-independent-verifier-indexer",
    "version": "1.0.0",
    "repository": "https://example.invalid/dacs/verifier-indexer",
    "commit": "4444444444444444444444444444444444444444"
  },
  "profile": {
    "id": "DACS-v0.1",
    "repository": "https://github.com/DACS-Agent-commerce/DACS-Standard",
    "commit": "494fc1b7a0a523d2da6e630203084eb2d6020a2b",
    "documents": {
      "CORE": "0.1",
      "DACS-1": "0.3",
      "DACS-2": "0.2",
      "DACS-3": "0.3",
      "DACS-4": "0.3",
      "DACS-5": "0.3"
    }
  },
  "roles": ["verifier", "directory-indexer"],
  "conformanceSuite": {
    "repository": "https://github.com/DACS-Agent-commerce/DACS-Standard",
    "commit": "494fc1b7a0a523d2da6e630203084eb2d6020a2b",
    "manifestPath": "conformance/MANIFEST.json",
    "manifestSha256": "185bf14ce7f1da6053b8dc0d7f208639cda6f078d9ff46f8d75a2a1767a7c408"
  },
  "claims": [
    {
      "id": "claim-bundle-verifier",
      "level": "capability",
      "result": "conformance-tested",
      "roles": ["verifier"],
      "modules": ["DACS-5"],
      "capabilityRefs": ["verify-attestation-bundle"],
      "ruleRefs": ["SIG-1", "SIG-2", "SIG-5"],
      "evidenceRefs": ["bundle-verifier-vectors"]
    },
    {
      "id": "claim-reputation-deriver",
      "level": "capability",
      "result": "conformance-tested",
      "roles": ["verifier"],
      "modules": ["DACS-5"],
      "capabilityRefs": ["derive-reputation"],
      "ruleRefs": ["DACS-5-10.5.1", "DACS-5-10.5.3"],
      "evidenceRefs": ["reputation-vectors"]
    },
    {
      "id": "claim-directory-indexer",
      "level": "capability",
      "result": "implemented",
      "roles": ["directory-indexer"],
      "modules": ["DACS-1"],
      "capabilityRefs": ["listing-directory"],
      "ruleRefs": ["DACS-1-6.3.6"],
      "evidenceRefs": []
    }
  ],
  "capabilities": [
    {
      "ref": "verify-attestation-bundle",
      "kind": "bundle-operation",
      "id": "verify-attestation-bundle",
      "modules": ["DACS-5"],
      "roles": ["verifier"],
      "supportStatus": "implemented",
      "testStatus": "passed",
      "evidenceRefs": ["bundle-verifier-vectors"]
    },
    {
      "ref": "derive-reputation",
      "kind": "reputation-operation",
      "id": "derive-reputation",
      "modules": ["DACS-5"],
      "roles": ["verifier"],
      "supportStatus": "implemented",
      "testStatus": "passed",
      "evidenceRefs": ["reputation-vectors"]
    },
    {
      "ref": "listing-directory",
      "kind": "directory-operation",
      "id": "listing-directory",
      "modules": ["DACS-1"],
      "roles": ["directory-indexer"],
      "supportStatus": "implemented",
      "availability": "live",
      "testStatus": "not_tested",
      "evidenceRefs": []
    }
  ],
  "testRuns": [
    {
      "id": "bundle-verifier-vectors",
      "result": "pass",
      "caseIds": ["bundle-0004-pass", "bundle-required-signer-fail", "bundle-malformed-key-error"],
      "command": "example-verifier conformance run --capability verify-attestation-bundle"
    },
    {
      "id": "reputation-vectors",
      "result": "pass",
      "caseIds": ["verify-reputation-determinism-receipt", "verify-consume-divergent"],
      "command": "example-verifier conformance run --capability derive-reputation"
    }
  ],
  "liveTests": [],
  "deviations": []
}
